{"availablePresets":["ATOLL","BARRIER_ISLAND","CENOTE","ICE_FJORD","WATERFALL_CHAIN"],"canonicalChecksum":"e4d22a57ac87778b5c7e8f5cc5e287a838f39a71f0bc94b5e5b379a2a0f7d9ea","catalogVersion":1,"contractVersion":"feature-support-catalog-v1","deferredDiagnostics":["OCEAN_TRENCH","MID_OCEAN_RIDGE","SUBMARINE_VOLCANO","BRAIDED_RIVER","DAM_RESERVOIR","ESTUARY","ALLUVIAL_FAN","RIVER_TERRACE","FLOATING_REEF","KARST_CAVE_SYSTEM"],"entries":[{"allowedUsages":["STANDALONE_FEATURE"],"entryId":"ABYSSAL_PLAIN","evidenceRef":"docs/design-v2/audits/v2-10-phase-gate.md","featureKindName":"ABYSSAL_PLAIN","lifecycleStatus":"EXPERIMENTAL","notes":["V2-10 plan-level offline; intent/standalone/export PARTIAL"],"primaryRole":"STANDALONE_FEATURE","profileId":"FND10","requiredReleaseCapability":"","requiredRuntime":"","support":{"child_plan_usage":"PARTIAL","export":"PARTIAL","intent_compile":"PARTIAL","offline_generate":"SUPPORTED","paper_apply":"UNSUPPORTED","post_apply_validation":"UNSUPPORTED","preview":"SUPPORTED","restart_recovery":"UNSUPPORTED","rollback":"UNSUPPORTED","snapshot":"UNSUPPORTED","standalone_usage":"PARTIAL","validation":"SUPPORTED","volume_overlay_usage":"NOT_APPLICABLE"}},{"allowedUsages":["STANDALONE_FEATURE"],"entryId":"ALPINE_MOUNTAIN_RANGE","evidenceRef":"docs/design-v2/audits + V2-2/3/4 phase gates","featureKindName":"ALPINE_MOUNTAIN_RANGE","lifecycleStatus":"SUPPORTED","notes":["Dedicated module binding; offline SUPPORTED; Paper columns EXPERIMENTAL: /lfc v2 accepts this capability prefix, per-prefix real-machine smoke pending (V2-11-01)"],"primaryRole":"STANDALONE_FEATURE","profileId":"SF16","requiredReleaseCapability":"environment-fields","requiredRuntime":"","support":{"child_plan_usage":"NOT_APPLICABLE","export":"SUPPORTED","intent_compile":"SUPPORTED","offline_generate":"SUPPORTED","paper_apply":"EXPERIMENTAL","post_apply_validation":"EXPERIMENTAL","preview":"SUPPORTED","restart_recovery":"EXPERIMENTAL","rollback":"EXPERIMENTAL","snapshot":"EXPERIMENTAL","standalone_usage":"SUPPORTED","validation":"SUPPORTED","volume_overlay_usage":"NOT_APPLICABLE"}},{"allowedUsages":["STANDALONE_FEATURE"],"entryId":"ARCHIPELAGO","evidenceRef":"docs/design-v2/audits/v2-9-phase-gate.md","featureKindName":"ARCHIPELAGO","lifecycleStatus":"EXPERIMENTAL","notes":["V2-9 plan-level offline G/V/P SUPPORTED; intent/standalone/export PARTIAL"],"primaryRole":"STANDALONE_FEATURE","profileId":"FND9","requiredReleaseCapability":"","requiredRuntime":"","support":{"child_plan_usage":"NOT_APPLICABLE","export":"PARTIAL","intent_compile":"PARTIAL","offline_generate":"SUPPORTED","paper_apply":"UNSUPPORTED","post_apply_validation":"UNSUPPORTED","preview":"SUPPORTED","restart_recovery":"UNSUPPORTED","rollback":"UNSUPPORTED","snapshot":"UNSUPPORTED","standalone_usage":"PARTIAL","validation":"SUPPORTED","volume_overlay_usage":"NOT_APPLICABLE"}},{"allowedUsages":["COMPOSITE_PRESET"],"entryId":"ATOLL","evidenceRef":"docs/design-v2/audits/v2-10-phase-gate.md","featureKindName":"","lifecycleStatus":"EXPERIMENTAL","notes":["COMPOSITE_PRESET; no FeatureKind"],"primaryRole":"COMPOSITE_PRESET","profileId":"PRESET","requiredReleaseCapability":"","requiredRuntime":"","support":{"child_plan_usage":"NOT_APPLICABLE","export":"PARTIAL","intent_compile":"NOT_APPLICABLE","offline_generate":"SUPPORTED","paper_apply":"UNSUPPORTED","post_apply_validation":"UNSUPPORTED","preview":"EXPERIMENTAL","restart_recovery":"UNSUPPORTED","rollback":"UNSUPPORTED","snapshot":"UNSUPPORTED","standalone_usage":"PARTIAL","validation":"SUPPORTED","volume_overlay_usage":"NOT_APPLICABLE"}},{"allowedUsages":["STANDALONE_FEATURE"],"entryId":"BACKSHORE_PLAINS","evidenceRef":"docs/audits/terrain-feature-gap-audit-2026-07-18.md","featureKindName":"BACKSHORE_PLAINS","lifecycleStatus":"EXPERIMENTAL","notes":["Diagnostic enum only; no dedicated generator"],"primaryRole":"STANDALONE_FEATURE","profileId":"ENUM5","requiredReleaseCapability":"","requiredRuntime":"","support":{"child_plan_usage":"UNSUPPORTED","export":"UNSUPPORTED","intent_compile":"EXPERIMENTAL","offline_generate":"UNSUPPORTED","paper_apply":"UNSUPPORTED","post_apply_validation":"UNSUPPORTED","preview":"UNSUPPORTED","restart_recovery":"UNSUPPORTED","rollback":"UNSUPPORTED","snapshot":"UNSUPPORTED","standalone_usage":"UNSUPPORTED","validation":"UNSUPPORTED","volume_overlay_usage":"UNSUPPORTED"}},{"allowedUsages":["COMPOSITE_PRESET"],"entryId":"BARRIER_ISLAND","evidenceRef":"docs/design-v2/audits/v2-10-phase-gate.md","featureKindName":"","lifecycleStatus":"EXPERIMENTAL","notes":["COMPOSITE_PRESET; no FeatureKind"],"primaryRole":"COMPOSITE_PRESET","profileId":"PRESET","requiredReleaseCapability":"","requiredRuntime":"","support":{"child_plan_usage":"NOT_APPLICABLE","export":"PARTIAL","intent_compile":"NOT_APPLICABLE","offline_generate":"SUPPORTED","paper_apply":"UNSUPPORTED","post_apply_validation":"UNSUPPORTED","preview":"EXPERIMENTAL","restart_recovery":"UNSUPPORTED","rollback":"UNSUPPORTED","snapshot":"UNSUPPORTED","standalone_usage":"PARTIAL","validation":"SUPPORTED","volume_overlay_usage":"NOT_APPLICABLE"}},{"allowedUsages":["STANDALONE_FEATURE"],"entryId":"BEDROCK_RIVER","evidenceRef":"docs/audits/terrain-feature-gap-audit-2026-07-18.md","featureKindName":"BEDROCK_RIVER","lifecycleStatus":"EXPERIMENTAL","notes":["Diagnostic enum only; no dedicated generator"],"primaryRole":"STANDALONE_FEATURE","profileId":"ENUM5","requiredReleaseCapability":"","requiredRuntime":"","support":{"child_plan_usage":"UNSUPPORTED","export":"UNSUPPORTED","intent_compile":"EXPERIMENTAL","offline_generate":"UNSUPPORTED","paper_apply":"UNSUPPORTED","post_apply_validation":"UNSUPPORTED","preview":"UNSUPPORTED","restart_recovery":"UNSUPPORTED","rollback":"UNSUPPORTED","snapshot":"UNSUPPORTED","standalone_usage":"UNSUPPORTED","validation":"UNSUPPORTED","volume_overlay_usage":"UNSUPPORTED"}},{"allowedUsages":["STANDALONE_FEATURE"],"entryId":"BREAKWATER_HARBOR","evidenceRef":"v2-6-14/15 smoke evidence + docs/design-v2/audits/v2-6-phase-gate.md + docs/design-v2/audits/v2-11-04-fawe-500-measurement.md + docs/design-v2/audits/v2-11-05-fawe-1000-measurement.md","featureKindName":"BREAKWATER_HARBOR","lifecycleStatus":"SUPPORTED","notes":["Dedicated module binding; offline SUPPORTED; Paper columns SUPPORTED within the measured 1000x1000 limit (features V2-11-01, dimensions V2-11-06); above 64x64 the evidence is fawe-2.15.2 only"],"primaryRole":"STANDALONE_FEATURE","profileId":"SF16","requiredReleaseCapability":"surface-2_5d","requiredRuntime":"paper-1.21.11+worldedit-7.3.19|fawe-2.15.2","support":{"child_plan_usage":"NOT_APPLICABLE","export":"SUPPORTED","intent_compile":"SUPPORTED","offline_generate":"SUPPORTED","paper_apply":"SUPPORTED","post_apply_validation":"SUPPORTED","preview":"SUPPORTED","restart_recovery":"SUPPORTED","rollback":"SUPPORTED","snapshot":"SUPPORTED","standalone_usage":"SUPPORTED","validation":"SUPPORTED","volume_overlay_usage":"NOT_APPLICABLE"}},{"allowedUsages":["STANDALONE_FEATURE"],"entryId":"CANYON","evidenceRef":"docs/design-v2/audits + V2-2/3/4 phase gates","featureKindName":"CANYON","lifecycleStatus":"SUPPORTED","notes":["Dedicated module binding; offline SUPPORTED; Paper columns EXPERIMENTAL: /lfc v2 accepts this capability prefix, per-prefix real-machine smoke pending (V2-11-01)"],"primaryRole":"STANDALONE_FEATURE","profileId":"SF16","requiredReleaseCapability":"hydrology-plan","requiredRuntime":"","support":{"child_plan_usage":"NOT_APPLICABLE","export":"SUPPORTED","intent_compile":"SUPPORTED","offline_generate":"SUPPORTED","paper_apply":"EXPERIMENTAL","post_apply_validation":"EXPERIMENTAL","preview":"SUPPORTED","restart_recovery":"EXPERIMENTAL","rollback":"EXPERIMENTAL","snapshot":"EXPERIMENTAL","standalone_usage":"SUPPORTED","validation":"SUPPORTED","volume_overlay_usage":"NOT_APPLICABLE"}},{"allowedUsages":["STANDALONE_FEATURE"],"entryId":"CAVE_ENTRANCE","evidenceRef":"docs/design-v2/audits/v2-9-phase-gate.md","featureKindName":"CAVE_ENTRANCE","lifecycleStatus":"EXPERIMENTAL","notes":["V2-9 plan-level offline G/V/P SUPPORTED; intent/standalone/export PARTIAL"],"primaryRole":"STANDALONE_FEATURE","profileId":"FND9","requiredReleaseCapability":"","requiredRuntime":"","support":{"child_plan_usage":"PARTIAL","export":"PARTIAL","intent_compile":"PARTIAL","offline_generate":"SUPPORTED","paper_apply":"UNSUPPORTED","post_apply_validation":"UNSUPPORTED","preview":"SUPPORTED","restart_recovery":"UNSUPPORTED","rollback":"UNSUPPORTED","snapshot":"UNSUPPORTED","standalone_usage":"PARTIAL","validation":"SUPPORTED","volume_overlay_usage":"PARTIAL"}},{"allowedUsages":["STANDALONE_FEATURE"],"entryId":"CAVE_NETWORK","evidenceRef":"docs/design-v2/audits/v2-5-phase-gate.md","featureKindName":"CAVE_NETWORK","lifecycleStatus":"EXPERIMENTAL","notes":["Plan-level volume generator; public Intent stays EXPERIMENTAL/diagnostic","May host child connectors","Paper columns EXPERIMENTAL: /lfc v2 accepts this capability prefix, per-prefix real-machine smoke pending (V2-11-01)"],"primaryRole":"STANDALONE_FEATURE","profileId":"VE4","requiredReleaseCapability":"sparse-volume","requiredRuntime":"","support":{"child_plan_usage":"PARTIAL","export":"SUPPORTED","intent_compile":"EXPERIMENTAL","offline_generate":"SUPPORTED","paper_apply":"EXPERIMENTAL","post_apply_validation":"EXPERIMENTAL","preview":"SUPPORTED","restart_recovery":"EXPERIMENTAL","rollback":"EXPERIMENTAL","snapshot":"EXPERIMENTAL","standalone_usage":"PARTIAL","validation":"SUPPORTED","volume_overlay_usage":"NOT_APPLICABLE"}},{"allowedUsages":["COMPOSITE_PRESET"],"entryId":"CENOTE","evidenceRef":"docs/design-v2/audits/v2-10-phase-gate.md","featureKindName":"","lifecycleStatus":"EXPERIMENTAL","notes":["COMPOSITE_PRESET; no FeatureKind"],"primaryRole":"COMPOSITE_PRESET","profileId":"PRESET","requiredReleaseCapability":"","requiredRuntime":"","support":{"child_plan_usage":"NOT_APPLICABLE","export":"PARTIAL","intent_compile":"NOT_APPLICABLE","offline_generate":"SUPPORTED","paper_apply":"UNSUPPORTED","post_ap